,date,text,compound,positive,negative,neutral
585,2020-10-07T15:54:10Z,"Mercedes-Benz EQC electric compact SUV. (Photo by Sjoerd van der Wal/Getty Images)
Getty Images/Sjoerd van der Wal
Investors seem happy after Mercedes parent Daimler announced new goals to slash co… [+4636 chars]",0.3818,0.10300000000000001,0.059000000000000004,0.838
586,2020-10-07T15:33:39Z,"Tesla said it caught a worker in the act of malicious sabotage at its main Fremont factory, according to company email obtained by Bloomberg News.
""Two weeks ago, our IT and InfoSec teams determined… [+1454 chars]",-0.5267,0.0,0.091,0.909
587,2020-10-07T15:08:21Z,The ARK Autonomous Technology &amp; Robotics ETF (ARKQ) does just what the name implies: offers investors exposure to the disruptive technology coming out of the autonomous and robotics sub-sectors. … [+6200 chars],-0.3182,0.0,0.071,0.929
588,2020-10-07T14:56:33Z,"Nikola (NKLA) and Tesla (TSLA). Two companies trying to change the way vehicles are powered in the United States. Two companies both named for inventor and the famed engineer, Nikola Tesla, who devel… [+5962 chars]",0.4215,0.076,0.0,0.924
589,2020-10-07T14:47:58Z,"Hand holding battery with full of energy
getty
In an Asia-dominated market, the world's greenest electric battery could be a European feat. Chinese manufacturers, alongside Japans Panasonic and U.S… [+7206 chars]",0.6486,0.159,0.0,0.841
590,2020-10-07T13:31:00Z,"NEW YORK, Oct. 7, 2020 /PRNewswire/ -- InvestorsObserver issues critical PriceWatch Alerts for TSLA, LEVI, UAL, CCL, and WORK.
Click a link below then choose between in-depth options trade idea repo… [+560 chars]",-0.3182,0.0,0.069,0.9309999999999999
591,2020-10-07T13:01:15Z,"Megacap stocks are holding onto premarket gains despite a House antitrust report saying that business separations may be needed.
The House antitrust subcommittee has released its report on Big Tech,… [+2237 chars]",0.34,0.07400000000000001,0.0,0.9259999999999999
592,2020-10-07T12:28:28Z,"BY THE NUMBERS
Dow futures pointed to a strong gain at Wednesday's open after President Donald Trump late Tuesday prodded Capitol Hill to approve additional coronavirus relief in separate bills. Hou… [+6992 chars]",0.8689,0.253,0.0,0.747
593,2020-10-07T12:15:00Z,"VANCOUVER, B,C., Oct. 7, 2020 /PRNewswire/ -- USA News Group  - You may never have heard of fluorspar, but every day you reach for products that rely on the fluorocarbons created from the mineral.
F… [+11681 chars]",0.3919,0.09699999999999999,0.0,0.903
594,2020-10-07T11:45:00Z,"Take a look at some of the biggest movers in the premarket:
Levi Strauss (LEVI) Levi Strauss reported quarterly earnings of 8 cents per share, compared to expectations of a 22 cents per share loss. … [+3089 chars]",0.2732,0.11699999999999999,0.061,0.8220000000000001
595,2020-10-07T11:31:14Z,"Despite reaffirming its full-year guidance, investors dumped shares of Altria (MO) earlier last month. Selling pressure finally eased toward the end of September as investors bet the worst is behind … [+5967 chars]",-0.6808,0.109,0.223,0.6679999999999999
596,2020-10-07T09:35:06Z,"(Bloomberg) -- When Sanjay Shah lost his job during the financial crisis more than a decade ago, he was one of thousands of mid-level traders suddenly out of work.Shah didnt take long to get back int… [+9586 chars]",-0.7506,0.0,0.155,0.845
597,2020-10-07T09:30:00Z,"With over 40% of its revenue coming from the auto sector, Infineon (OTCQX:IFNNY) is heavily dependent not just on the nascent recovery in auto builds around the world, but on the future trajectory of… [+7771 chars]",0.0,0.0,0.0,1.0
598,2020-10-07T02:37:00Z,"Calls from clients usually start pouring in whenever stocks take a surprise tumble.But lately, financial advisers have been getting more calls from worried clients about devastating West Coast wildfi… [+4830 chars]",-0.6872,0.059000000000000004,0.18899999999999997,0.753
599,2020-10-07T01:34:13Z,"According to the popular Chinese media, a definitely major topic of discussion amongst the whole New Energy Vehicle manufacturers is something that Tesla unexpectedly did. The company reportedly decr… [+3312 chars]",0.765,0.22,0.0,0.78
600,2020-10-07T01:00:00Z,"Tesla CEO Elon Musk jokes with the media at a visit to the construction site of a new European ... [+] ""Gigafactory"" near Berlin last month.
AFP via Getty Images
The wealth of the worlds billionair… [+4265 chars]",0.6369,0.133,0.0,0.867
601,2020-10-07T00:54:00Z,"Dow Jones futures reversed higher late Tuesday, along with S&amp;P 500 futures, while Nasdaq 100 futures were barely lower, on new President Trump coronavirus stimulus tweets. Tech giant Apple announ… [+8107 chars]",-0.228,0.0,0.057999999999999996,0.9420000000000001
602,2020-10-06T22:35:28Z,"WASHINGTON, DC - FEBRUARY 16: U.S. President Donald Trump acknowledges the coal miners in ... [+] attendance prior to signing H.J. Res. 38, disapproving the rule submitted by the US Department of the… [+9380 chars]",0.0,0.0,0.0,1.0
603,2020-10-06T21:34:02Z,"(Bloomberg) -- When Sanjay Shah lost his job during the financial crisis more than a decade ago, he was one of thousands of mid-level traders suddenly out of work.Shah didnt take long to get back int… [+9586 chars]",-0.7506,0.0,0.155,0.845
604,2020-10-06T21:21:35Z,"A Tesla owner in Rhode Island will be allowed to troll gas-powered cars in traffic for another day.
A state judge issued a preliminary injunction on Friday allowing Sean Carroll to retain his vanity… [+1709 chars]",0.0,0.0,0.0,1.0
605,2020-10-06T20:25:00Z,"Shares of Tesla Inc. 
 TSLA,
 -2.74%
shed 2.75% to $413.98 Tuesday, on what proved to be an all-around rough trading session for the stock market, with the NASDAQ Composite Index 
 COMP,
 -1.57%… [+709 chars]",0.29600000000000004,0.062,0.0,0.937
606,2020-10-06T20:17:19Z,"(Bloomberg) -- When Sanjay Shah lost his job during the financial crisis more than a decade ago, he was one of thousands of mid-level traders suddenly out of work.Shah didnt take long to get back int… [+9586 chars]",-0.7506,0.0,0.155,0.845
607,2020-10-06T20:12:14Z,"Every day, thousands of investors settle for mediocrity. Its not their fault. Theyve been fed the same, wrong advice for years: Buy the S&amp;P 500.
Get The Full Ray Dalio Series in PDF
Get the ent… [+4857 chars]",-0.2828,0.054000000000000006,0.106,0.84
608,2020-10-06T20:02:44Z,"Introduction
In the Netflix (NFLX) documentary ""The Social Dilemma"", data-driven tech companies with machine-learning algorithms are brought to the spotlight. The algorithms are accused of polarizin… [+12849 chars]",-0.29600000000000004,0.0,0.075,0.925
609,2020-10-06T19:45:50Z,"(Bloomberg) -- When Sanjay Shah lost his job during the financial crisis more than a decade ago, he was one of thousands of mid-level traders suddenly out of work.Shah didnt take long to get back int… [+9586 chars]",-0.7506,0.0,0.155,0.845
610,2020-10-06T19:19:27Z,"The electric auto industry is made up of companies that manufacture cars, trucks, vans, and commercial vehicles, as well as those that manufacture or supply electric automobile parts and service. Thi… [+5278 chars]",0.2732,0.062,0.0,0.938
611,2020-10-06T16:37:37Z,"Editors Note: This is a free edition of The Technical Indicator, a daily MarketWatch subscriber newsletter. To get this column each market day, click here.Broadly speaking, the major U.S. benchmarks … [+17690 chars]",0.5106,0.102,0.0,0.898
612,2020-10-06T16:06:42Z,"Investment Thesis
Investors were expecting an update on the Bankable Feasibility Study for the Jervois Idaho Cobalt Operations this month and that arrived with an after-tax 8% NPV of $95.7m. On the … [+11757 chars]",0.0,0.0,0.0,1.0
613,2020-10-06T14:45:00Z,"NEW YORK, Oct. 6, 2020 /PRNewswire/ -- InvestorsObserver issues critical PriceWatch Alerts for F, NVDA, TSLA, AMD, and BAC.
To see how InvestorsObserver's proprietary scoring system rates these stoc… [+508 chars]",-0.3182,0.0,0.071,0.929
614,2020-10-06T13:32:45Z,"(Pexels)
One of the many extreme occurrences in 2020 has been the tremendous performance of electric vehicle companies. Tesla (TSLA) has led the way with a nearly 400% share-price increase this year… [+7205 chars]",0.3182,0.067,0.0,0.9329999999999999
615,2020-10-06T13:30:00Z,"GOTHENBURG, SWEDEN - 2019/09/14: An American automotive and energy company that specialises in ... [+] electric car manufacturing Tesla logo seen in Gothenburg. (Photo by Karol Serewis/SOPA Images/Li… [+4438 chars]",0.2732,0.07,0.0,0.93
616,2020-10-06T13:22:20Z,"Getty Images
Getty Images
Key Takeaways:
<ul><li>Stimulus hopes continue to be front and center, but no new progress so far today</li><li>Bond market suddenly looks interesting as yields spin upwa… [+11027 chars]",0.7469,0.235,0.07200000000000001,0.693
617,2020-10-06T13:04:28Z,"getty
As the market raced to record-highs, weve identified several stocks that fiduciaries cannot reasonably justify owning or recommending given the abnormally large disconnect between valuation an… [+29019 chars]",0.0,0.0,0.0,1.0
618,2020-10-06T12:23:00Z,"Despite the warning signs, the George W. Bush Administration made Chinas most favored nation trade status permanent under pressure from a broad swath of multinationals and global political elites in … [+4398 chars]",0.4458,0.145,0.062,0.7929999999999999
619,2020-10-06T11:38:50Z,"Surge in IPOB Price Due to Opendoor Announcement
Over the last month, shares of Social Capital Hedosophia Holdings Corp II (IPOB) have risen ~70%, in large part due to the announcement that IPOB wil… [+7535 chars]",0.29600000000000004,0.059000000000000004,0.0,0.941
621,2020-10-06T11:34:00Z,"Yesterday, Tesla (NASDAQ:TSLA) announced it will make a $25,000 electric vehicle sometime in the near future, and it had me feeling some deja vu from the last decade following the solar industry. Ten… [+7019 chars]",0.128,0.043,0.0,0.9570000000000001
622,2020-10-06T07:02:43Z,"Yahoo fait partie de Verizon Media. Nos partenaires et nous-mêmes stockerons et/ou utiliserons des informations concernant votre appareil, par lintermédiaire de cookies et de technologies similaires,… [+879 chars]",0.0,0.0,0.0,1.0
623,2020-10-06T06:38:37Z,"Yahoo fait partie de Verizon Media. Nos partenaires et nous-mêmes stockerons et/ou utiliserons des informations concernant votre appareil, par lintermédiaire de cookies et de technologies similaires,… [+879 chars]",0.0,0.0,0.0,1.0
624,2020-10-06T04:31:02Z,"Alphabet (GOOG) (GOOGL), formerly listed as Google, is the ""value"" pick from the gang of high-growth, high-tech darlings in October 2020. The original FANG subset of Facebook (FB), Amazon (AMZN), Net… [+8380 chars]",0.7351,0.19399999999999998,0.0,0.8059999999999999
625,2020-10-06T03:18:24Z,"Yahoo fait partie de Verizon Media. Nos partenaires et nous-mêmes stockerons et/ou utiliserons des informations concernant votre appareil, par lintermédiaire de cookies et de technologies similaires,… [+879 chars]",0.0,0.0,0.0,1.0
626,2020-10-06T01:38:15Z,"Tesla (TSLA) is famous for setting ambitious production and delivery goals, and its guidance for 2020 was no exception. In January, the upstart electric vehicle company announced that, For full year … [+7872 chars]",0.2263,0.085,0.061,0.8540000000000001
627,2020-10-06T01:05:00Z,"President Donald Trump vowed four years ago to bring back the U.S. coal industry.That never happened, as the New York Times and the public radio program The Allegheny Front each pointed out recently … [+4037 chars]",0.0,0.0,0.0,1.0
628,2020-10-05T18:55:52Z,"Facebook CEO Mark Zuckerberg. Photo by Justin Sullivan/Getty Images.
Getty Images
The quest for open-ended stocks goes on and on. Nobody dares deal with the statistical experience. Namely, the aver… [+6964 chars]",0.0,0.0,0.0,1.0
629,2020-10-05T16:36:08Z,"OMAHA, Neb.--(BUSINESS WIRE)--The Investor Movement Index® (IMXSM) increased to 5.71 in September, up 15.82 percent from its August score of 4.93. The IMX is TD Ameritrades proprietary, behavior-base… [+4643 chars]",0.2732,0.068,0.0,0.932
630,2020-10-05T16:04:24Z,"PayPal and Palantir founder Peter Thiel is the latest investor in Swiss EV startup Piëch Automotive, ... [+] completing its A-funding round. Founded by Anton (Toni) Piëch, the son of European automot… [+4293 chars]",0.0,0.0,0.0,1.0
631,2020-10-05T14:44:14Z,"Vale S.A. (VALE) shares rose more than 2% during pre-market hours after Reuters reported that the mining giant was in talks with Tesla, Inc. (TSLA) and other electric vehicle (EV) firms about securin… [+2785 chars]",0.29600000000000004,0.061,0.0,0.9390000000000001
632,2020-10-05T14:21:00Z,"The automobile sector is largely higher on more enthusiasm over the pace of sales in China, highlighted again today by a strong deliveries report from XPeng.
There is also positive comments out from… [+517 chars]",0.8777,0.24600000000000002,0.0,0.754
633,2020-10-05T13:09:07Z,"Stocks closed down on Friday, but Monday’s trading session was looking like a bounce, with the major indexes up 0.6% or so on average. As many investors missed out on the recovery from late in March,… [+3684 chars]",0.1154,0.079,0.068,0.853
634,2020-10-05T12:28:06Z,"With the end of the winter set in another pleasant pumped-dry period, and, while I took a little time off, a fresh picture of life in America began to form before my eyes. The uncertainties of 1919 w… [+10626 chars]",0.4472,0.128,0.057999999999999996,0.815
635,2020-10-05T11:44:45Z,"Shares of Tesla Inc. 
 TSLA, 
 -7.37%
rose 1.9% in premarket trading Monday, after dropping 7.4% in the previous session, as a long-time bearish analyst lifted his price target in the wake of the … [+1187 chars]",0.29600000000000004,0.062,0.0,0.937
636,2020-10-05T09:55:17Z,"Tesla (TSLA) is reportedly in talks with Indonesia’s government to build new venture to secure some of the country’s nickel supply.
While many companies are looking to secure lithium, cobalt, and gr… [+2122 chars]",0.5859,0.13,0.0,0.87
637,2020-10-05T09:04:13Z,"Volkswagen
 VWAGY, 
 -1.58%
  sees the future as electric, and it has bold plans to be a totally carbon-neutral company by 2050. Much of this earth-friendly strategy involves electric vehicles, an… [+9441 chars]",0.3818,0.08,0.0,0.92
638,2020-10-05T04:49:40Z,"Yahoo fait partie de Verizon Media. Nos partenaires et nous-mêmes stockerons et/ou utiliserons des informations concernant votre appareil, par lintermédiaire de cookies et de technologies similaires,… [+879 chars]",0.0,0.0,0.0,1.0
639,2020-10-05T03:35:17Z,"Source
Despite Q3 being a volatile and a somewhat rocky quarter, our diversified portfolio delivered some nice returns in several sectors. In particular, technology, GSMs, as well as blockchain ente… [+7089 chars]",0.5994,0.149,0.0,0.851
640,2020-10-05T00:04:12Z,The Piedmont Lithium Ltd(ASX: PLL) share price soared more than 200% in a week following the announcement of an offtake deal with Tesla Inc(NASDAQ: TSLA). With Tesla’s intentions to localise the lith… [+3156 chars],0.29600000000000004,0.064,0.0,0.9359999999999999
641,2020-10-04T22:00:00Z,"FILE - In this June 14, 2019, file photo, Russian President Vladimir Putin, right, toasts with ... [+] Chinese President Xi Jinping prior to the Conference on Interaction and Confidence Building Meas… [+6588 chars]",0.5106,0.09300000000000001,0.0,0.907
642,2020-10-04T20:20:55Z,"The Past Week, In A Nutshell
What Happened: Last week ended positive despite the uncertainty-driven news cycle.
Remember This: Market swings can be unsettling, and theres a lot to think about with … [+5720 chars]",0.5574,0.10400000000000001,0.0,0.8959999999999999
643,2020-10-04T19:09:09Z,"Momentum
getty
If you are looking for a low-vol, value or momentum portfolio, use this fund screener.
Invest according to a formula that weights stock positions in a certain way. Beat the market, … [+3451 chars]",0.5423,0.13,0.0,0.87
644,2020-10-04T14:29:39Z,"Yahoo fait partie de Verizon Media. Nos partenaires et nous-mêmes stockerons et/ou utiliserons des informations concernant votre appareil, par lintermédiaire de cookies et de technologies similaires,… [+879 chars]",0.0,0.0,0.0,1.0
645,2020-10-04T13:41:16Z,"Ellington Financial, Inc. (NYSE:EFC) is okay. Welcome to a weird article! There has been some reader interest in EFC and we wanted to deliver an update for investors. If you're looking for someone to… [+8041 chars]",0.7574,0.2,0.042,0.758
646,2020-10-04T09:31:18Z,"Bitcoin has had a strong start to the decade, adding over 40% to its price so far this yearand taking its market capitalization to around $200 billion.
The bitcoin price, which began the year at aro… [+2958 chars]",0.5106,0.084,0.0,0.9159999999999999
647,2020-10-04T05:53:06Z,"Yahoo fait partie de Verizon Media. Nos partenaires et nous-mêmes stockerons et/ou utiliserons des informations concernant votre appareil, par lintermédiaire de cookies et de technologies similaires,… [+879 chars]",0.0,0.0,0.0,1.0
648,2020-10-03T19:35:47Z,"Yahoo fait partie de Verizon Media. Nos partenaires et nous-mêmes stockerons et/ou utiliserons des informations concernant votre appareil, par lintermédiaire de cookies et de technologies similaires,… [+879 chars]",0.0,0.0,0.0,1.0
650,2020-10-03T19:18:42Z,"Yahoo fait partie de Verizon Media. Nos partenaires et nous-mêmes stockerons et/ou utiliserons des informations concernant votre appareil, par lintermédiaire de cookies et de technologies similaires,… [+879 chars]",0.0,0.0,0.0,1.0
652,2020-10-03T17:11:13Z,"Welcome to the September 2020 edition of Electric Vehiclecompany news. September saw a great global EV sales result for August, boosted by a surge in Europe EV sales again.
By far the biggest news f… [+35402 chars]",0.8625,0.231,0.0,0.769
653,2020-10-03T15:55:21Z,"Where is the stock market rally going? Dow Jones futures won't reopen until Sunday. But in the near term the answer may be another question: How is President Trump doing?
Trump Condition Improving
… [+9142 chars]",0.4871,0.085,0.0,0.915
654,2020-10-03T14:19:55Z,"Auto makers, pumping billions of dollars into developing electric cars, are now facing a critical choice: get more involved with manufacturing the core batteries or buy them from others.
Batteries a… [+5569 chars]",-0.3182,0.0,0.069,0.9309999999999999
655,2020-10-03T12:33:53Z,"NEW RESOURCES 
DigitalNC: The Black Mountain News Now Online. “DigitalNC has added a new title to our newspaper collection: The Black Mountain News. Covering the initial five years of publication, f… [+6330 chars]",0.0,0.0,0.0,1.0
656,2020-10-03T12:21:46Z,"by Graham Summers of Gains, Pains, &amp; Capital
Stocks ripped higher yesterday. However, they ended the session near the lows at support (green line in the chart below). The overnight futures sessi… [+1611 chars]",0.128,0.128,0.11599999999999999,0.7559999999999999
657,2020-10-03T11:50:19Z,"The new CEO of the Ford Motor Company (NYSE: F), Jim Farley, joins a line of leaders Executive Chairman Bill Ford, Jr. has shuffled in and out of the job since the start of 1999. The list totals seve… [+2148 chars]",0.0,0.0,0.0,1.0
658,2020-10-03T11:19:48Z,95% +6.5% 78% Performance Shares Trends Moe Mo 85% 60% CTMX 0.45 A +0.45% FTR -0.23 V -2.34% CSco -1.01 V -1.899 ww 0.02 +2 CHK AAPL PRTO AMZN W TSLA AVGO A SIRI 0.65,0.29600000000000004,0.071,0.0,0.929
659,2020-10-03T11:08:55Z,Costco Wholesale Corporation (NASDAQ: COST) has been in the car sales business for years. It occasionally runs the equivalent of a “sale”. The most recent sale promotes many of the models in the Chev… [+2070 chars],0.3947,0.073,0.0,0.927
660,2020-10-03T10:31:53Z,"Source
Uber Technologies, Inc. (NYSE:UBER) has recently come under heavy criticism for its inability to generate sufficient earnings to justify the seemingly high valuation multiples attached to its… [+14267 chars]",-0.6808,0.0,0.16699999999999998,0.833
661,2020-10-03T10:00:00Z,"Despite the much greater sales success of battery electric vehicles (BEV) over fuel cell electric vehicles (FCEVs), theres still a huge amount of interest in hydrogen as the green replacement for fos… [+6690 chars]",0.7839,0.22399999999999998,0.053,0.723
662,2020-10-12T22:06:00Z,"Dow Jones futures rose modestly late Monday, along with S&amp;P 500 futures and Nasdaq futures. The stock market rally had a powerful session, with Apple stock and Amazon.com (AMZN) leading a megacap… [+7662 chars]",0.4215,0.083,0.0,0.917
663,2020-10-12T19:46:57Z,"- By Dilantha De Silva
The earnings season will kick off on Oct. 13 with JPMorgan Chase &amp; Co. (NYSE:JPM) reporting third-quarter results. Banks will dominate the first week of the season as usua… [+8378 chars]",-0.128,0.0,0.042,0.958
664,2020-10-12T19:04:46Z,"By ALT Perspective
Despite the reported Chinese netizens' perception of President Donald Trump's coronavirus infection as a ""comeuppance"", Chinese investors together with Asian ones cheered his prom… [+17845 chars]",0.5106,0.109,0.0,0.8909999999999999
665,2020-10-12T18:54:28Z,"Lines drawn in the sand in Washington D.C. are holding the next stimulus package hostage, but what does this mean for Wall Street? Despite the stalemate on Capitol Hill, the S&amp;P 500 has rallied 9… [+7449 chars]",0.0,0.0,0.0,1.0
666,2020-10-12T18:53:00Z,"You have to put all your money into 5 stocks and hold it for 10 years, what are you buying and why? In Reddits Stocks community, an investor going by the name 7thAccountDontDelete posed that question… [+2035 chars]",0.0,0.0,0.0,1.0
667,2020-10-12T18:44:18Z,Electric vehicle and renewable energy systems manufacturer Tesla Inc (NASDAQ:TSLA(/stock])scored an important win today when the credit rating division of the S&amp;P Global financial information and… [+3558 chars],0.8519,0.3,0.0,0.7
668,2020-10-12T18:07:15Z,"The Retire In Peace portfolio, or R.I.P. portfolio, was first introduced to the Seeking Alpha community in December 2015, and I have published quarterly articles that captured the activity and perfor… [+27936 chars]",0.5423,0.10099999999999999,0.0,0.899
669,2020-10-12T17:13:54Z,"There is no longer any question that electric vehicles will eventually replace internal combustion engines. In Norway, the global electric car leader, sales of battery electric cars edged up to 48% o… [+11387 chars]",-0.29600000000000004,0.0,0.062,0.937
670,2020-10-12T17:00:00Z,"S&amp;P Global Ratings on Monday raised its Tesla Inc. debt ratings to BB-, from B+, leaving the Silicon Valley car makers bonds two notches from investment grade. Improved execution, increasingly ef… [+958 chars]",0.1531,0.085,0.068,0.847
671,2020-10-12T16:14:32Z,"That electric vehicles are the future has been known for some time, but it seems as though the auto industry in general is only now getting to grips with the reality of the situation. The greater com… [+10398 chars]",0.5023,0.079,0.0,0.9209999999999999
672,2020-10-12T15:10:55Z,"The unprecedented run-up in Tesla Inc (NASDAQ: TSLA) stock has made sell-side analyst wary about its future trajectory.
The Tesla Analyst: Needham analyst Rajvindra Gill maintained an Underperform r… [+2673 chars]",0.0,0.0,0.0,1.0
673,2020-10-12T15:05:44Z,"Tesla (TSLA) has taken its first regulatory step to prepare for the production of its new 4680 battery cell in Texas.
When we revealed Tesla’s new 4680 battery cell ahead of the Battery Day last mon… [+1849 chars]",0.0,0.0,0.0,1.0
674,2020-10-12T13:48:13Z,"Short interest moves among automakers’ stocks were mostly higher during the two-week reporting period that ended on September 30.  Of the companies we watch, short interest increased on five of six e… [+2911 chars]",0.7964,0.207,0.0,0.7929999999999999
675,2020-10-12T13:31:00Z,"NEW YORK, Oct. 12, 2020 /PRNewswire/ -- InvestorsObserver issues critical PriceWatch Alerts for TWLO, GE, NLS, MSFT, and TSLA.
Click a link below then choose between in-depth options trade idea repo… [+560 chars]",-0.3182,0.0,0.069,0.9309999999999999
676,2020-10-12T12:54:17Z,"Employees of Tyson Foods process chicken. (Photo by Greg Smith)
Corbis via Getty Images
 The past year was horrible for dividend investing. Many investors these days are indifferent to dividends. T… [+4484 chars]",-0.6486,0.0,0.146,0.8540000000000001
677,2020-10-12T12:30:00Z,"GOTHENBURG, SWEDEN - 2019/09/14: An American automotive and energy company that specialises in ... [+] electric car manufacturing Tesla logo seen in Gothenburg. (Photo by Karol Serewis/SOPA Images/Li… [+4601 chars]",0.2732,0.07,0.0,0.93
678,2020-10-12T12:04:00Z,"Dow Jones futures, along with S&amp;P 500 futures and especially Nasdaq 100 futures, were higher early Monday amid stalled coronavirus stimulus talks as the current stock market rally continues. Tech… [+6254 chars]",-0.2023,0.0,0.055,0.945
679,2020-10-12T10:59:00Z,"With market volatility rising ahead of Novembers U.S. presidential and Congressional elections, investors are parsing what polls and policy proposals mean for everything from energy stocks to shares … [+7219 chars]",0.5106,0.133,0.0,0.867
680,2020-10-12T03:01:50Z,"Which stocks are always on investors wish lists? Growth stocks. Time and time again, the pros on the Street point to tickers with above-average growth prospects as must-haves, as they stand to delive… [+10298 chars]",0.8442,0.24600000000000002,0.0,0.754
681,2020-10-12T03:01:00Z,"Tesla Inc (NASDAQ: TSLA) CEO Elon Musk on Sunday dismissed allegations that he ""stole"" the automaker from chief executive Martin Eberhard, claiming that more of the workers at the electric vehicle co… [+2505 chars]",0.0,0.0,0.0,1.0
