,date,text,compound,positive,negative,neutral
0,2020-09-15T22:30:51Z,"This article was contributed by Lior Gantz of The Wealth Research Group.
Gold is currently trading for JUST UNDER $2,000/ounce and Wall Street firms have issued PRICE TARGETS of $2,500 and $3,000. B… [+2947 chars]",0.4939,0.086,0.0,0.914
1,2020-09-15T22:15:16Z,"Growth shares have pummelled value stocks in the past few years.
You just need to look at the successful technology stocks in Australia and overseas as evidence of this:
<ul><li>Even after the pull… [+3545 chars]",0.875,0.262,0.0,0.738
2,2020-09-15T21:02:26Z,"Image: EpicTop10.com
By Brian Nelson, CFA
For every Amazon (AMZN) that made it, there are hundreds, maybe thousands, from the dot-com era that didn't. Very few remember Pets.com or etoys.com, both … [+10533 chars]",0.1779,0.05,0.0,0.95
3,2020-09-15T20:43:43Z,"Hindenburg Research, the short seller that successfully beat down Nikola Corporation (NASDAQ: NKLA) share price by 40%, fired more shots at the beleaguered electric truck startup on Tuesday. Nikola r… [+6459 chars]",0.2023,0.142,0.095,0.763
4,2020-09-15T20:28:00Z,"The Dow Jones Industrial Average gave up gains and finished flat, while tech advanced, led by Tesla  (TSLA) - Get Report.
The Dow finished up 2 points, or 0.01%, to 27,995, the S&amp;P 500 gained 0.… [+1929 chars]",0.7184,0.175,0.0,0.825
5,2020-09-15T20:00:25Z,"Listen to a recap of the top stories of the day from Electrek. Quick Charge is available now on Apple Podcasts, Spotify, TuneIn and our RSS feed for Overcast and other podcast players.
New episodes … [+902 chars]",0.2023,0.049,0.0,0.951
6,2020-09-15T19:44:38Z,"Ahead of announcing the Bronco lineup, Ford's (F) early summer rally faded quickly. Ford stock failed to take on the pre-COVID-19 sell-off low of $8.00 in June. Investors plowed their money in Nikola… [+4755 chars]",-0.6597,0.0,0.141,0.8590000000000001
7,2020-09-15T19:06:00Z,"NextEra Energy, Inc. (NYSE: NEE) has created some buzz around its stock on the heels of announcing a 4-for-1 stock split. While stock splits do not technically create anything real value in the share… [+5114 chars]",0.5699,0.165,0.046,0.789
8,2020-09-15T18:52:44Z,"So far, September has been a wild ride of ups and downs. Following the recent bout of volatility, stocks have ticked higher again. But as uncertainty regarding another rescue program and the presiden… [+9931 chars]",-0.2263,0.084,0.132,0.785
9,2020-09-15T18:12:56Z,"The Invesco QQQ Trust (QQQ) is an ETF that tracks a market cap weighted index of Nasdaq 100 stocks, while the Technology Select Sector SPDR Fund (XLK) tracks an index of S&amp;P500 technology stocks.… [+4143 chars]",0.5106,0.08800000000000001,0.0,0.912
10,2020-09-15T17:56:03Z,"The appropriately-named ""Nikola Badger."" Possibly the first of several vehicles where Nikola provides the badge and little else. 
There's suddenly a lot of controversy around Nikola (NKLA), and abou… [+6562 chars]",0.0,0.0,0.0,1.0
11,2020-09-15T17:08:34Z,"Japanese High
In 1989, the Japanese Nikkei hit 38,916. It was a time of craziness. The Emperor's palace was valued at equal to all of the real estate in California. Such prices are unsustainable. Th… [+22402 chars]",0.0772,0.073,0.066,0.861
12,2020-09-15T16:50:17Z,"Tesla Inc (NASDAQ: TSLA) is known for adding features and fixing problems by sending software updates to the almost 1 million cars on the road. Back when the Model 3 was first released, Tesla reduced… [+988 chars]",-0.4019,0.0,0.07400000000000001,0.9259999999999999
13,2020-09-15T16:42:32Z,"Editors Note: This is a free edition of The Technical Indicator, a daily MarketWatch subscriber newsletter. To get this column each market day, click here.Technically speaking, the major U.S. benchma… [+19478 chars]",0.5106,0.102,0.0,0.898
14,2020-09-15T16:42:32Z,"Editors Note: This is a free edition of The Technical Indicator, a daily MarketWatch subscriber newsletter. To get this column each market day, click here.Technically speaking, the major U.S. benchma… [+19534 chars]",0.5106,0.102,0.0,0.898
15,2020-09-15T16:22:59Z,"getty
After markets bounced back nicely yesterday from a tough past two weeks, markets opened the day yet again pointing to positive gains. There was not one single catalyst causing the rally, howev… [+6791 chars]",0.8126,0.22,0.037000000000000005,0.743
16,2020-09-15T16:12:00Z,"The Dow Jones Industrial Average was off highs midday, but looked on track to extend its gains for a third straight session.
XThe Nasdaq rallied 1.4%, the S&amp;P 500 rose 0.9% and the Dow Jones ind… [+4419 chars]",0.7579,0.18100000000000002,0.0,0.8190000000000001
17,2020-09-15T16:08:00Z,"The Dow Jones Industrial Average rallied 225 points early Tuesday before trimming gains, looking to add to Monday's strong stock market advance. Dow Jones leader Apple gained 2%, while Tesla jumped 6… [+6742 chars]",0.8074,0.21100000000000002,0.0,0.789
18,2020-09-15T16:00:00Z,"FLIR demonstrates the ability of its thermal imaging sensor to detect pedestrians in dark clothes at ... [+] night
FLIR
In recent years as the number of traffic fatalities started to edge back up a… [+7390 chars]",-0.3182,0.087,0.094,0.8190000000000001
19,2020-09-15T15:41:00Z,"The stock market has done well so far this week, with the favorable momentum continuing on Tuesday morning. Many investors had been looking for opportunities to get into the market, and the recent pu… [+2887 chars]",0.7783,0.191,0.0,0.809
20,2020-09-15T15:19:21Z,"getty
Markets began the day looking to extend yesterdays gains and continue the recovery from the losses of the last two weeks. While there wasnt a single cause for the gains, there is cautious opti… [+8054 chars]",0.34,0.156,0.099,0.745
21,2020-09-15T15:13:58Z,"It's no secret that Tesla (TSLA) is aggressively valued. It has ballooned to more than a $300 billion market cap and neared half a trillion at its highs. It's forward P/E is over 100, more than 10 ti… [+8206 chars]",-0.1531,0.068,0.106,0.825
22,2020-09-15T15:04:49Z,"Tesla’s stock (TSLA) is rising again today as Goldman Sachs reports that Tesla’s mobile app downloads point to a possible delivery beat in Q3.
The end of the quarter is coming and the market is tryi… [+2244 chars]",0.0,0.0,0.0,1.0
23,2020-09-15T15:02:34Z,"Back in June, Ohio EV startup Lordstown Motors revealed its first electric pickup truck. Lordstown entered the stock market one month ago through the merger with DiamondPeak Holdings Corporation (NAS… [+4230 chars]",0.0,0.0,0.0,1.0
24,2020-09-15T13:55:00Z,"Stocks leapt at the starting bell Tuesday, as the Dow scrambled back above the 28,000 level and the market moved to build on Monday's positive action. Tesla and Nvidia spearheaded the early gains amo… [+8063 chars]",0.7184,0.15,0.0,0.85
25,2020-09-15T13:31:00Z,"NEW YORK, Sept. 15, 2020 /PRNewswire/ -- InvestorsObserver issues critical PriceWatch Alerts for TSLA, ROKU, RIO, NKE, and WM.
Click a link below then choose between in-depth options trade idea repo… [+560 chars]",-0.3182,0.0,0.069,0.9309999999999999
26,2020-09-15T13:00:00Z,"Denver Post via Getty Images
Before the coronavirus outbreak, I doubted telehealth had much potential. I remember sitting outside a café with our publisher and telling him it was a bust.
Trust a qu… [+4714 chars]",0.29600000000000004,0.096,0.061,0.843
27,2020-09-15T12:54:04Z,"BY THE NUMBERS
U.S. stock futures were pointing to further gains at Tuesday's open as the Federal Reserve begins its two-day September meeting. Optimism toward a coronavirus vaccine sparked a broad … [+7607 chars]",0.7096,0.16899999999999998,0.0,0.831
28,2020-09-15T12:41:11Z,"Shares of Tesla Inc. 
 TSLA, 
 +12.58%
surged 4.3% in premarket trading Tuesday, to extend the recent run up that retraced more than half of the bear-market selloff earlier this month. The electri… [+871 chars]",0.4404,0.109,0.0,0.8909999999999999
29,2020-09-15T12:32:00Z,"getty
Closed-end funds (CEFs) are the ultimate sleeper investmentif you hold them, you know they hand out massive dividends (7% yields, on average!). Plus, their often-discounted share prices set yo… [+4495 chars]",0.69,0.159,0.0,0.841
30,2020-09-15T12:08:17Z,"Check out the companies making headlines before the bell:
Nvidia (NVDA) Shares of the chip stock rose in premarket trading after Needham raised its price target to a Street high of $700 per share fr… [+2356 chars]",0.5267,0.115,0.0,0.885
31,2020-09-15T07:32:15Z,"Investment Thesis
The changing economics of energy production (fracking) and energy consumption (EVs), spurred by environmental agitation and electronics technology advances, urges economic solar en… [+7671 chars]",0.29600000000000004,0.139,0.066,0.795
32,2020-09-15T03:45:30Z,"Keysight Technologies Inc. (KEYS) commercializes electronic design and test solutions for communications, electronics, and aerospace industries. These are the behind-the-scenes technical applications… [+9213 chars]",0.1779,0.069,0.0,0.9309999999999999
33,2020-09-15T03:30:57Z,"Every week, we Fools like to have a look at which shares Aussies are taking the most interest in. Today, we’ll be looking at the most traded US shares. Commonwealth Bank of Australia‘s (ASX: CBA) Com… [+3806 chars]",0.7178,0.225,0.07,0.705
34,2020-09-15T00:47:00Z,"The Tesla Inc(NASDAQ: TSLA) share price was an exceptionally strong performer on Wall Street on Monday night.
The electric vehicles company’s shares snapped their losing streak and zoomed a sizeable… [+2335 chars]",0.659,0.213,0.069,0.718
35,2020-09-15T00:23:30Z,"In my piece TSLA: Beauty Happens, I concluded with the comment that if the aesthetic theory of evolution as discussed in Richard Prums book The Evolution of Beauty: How Darwins Forgotten Theory of Ma… [+6532 chars]",0.7717,0.183,0.046,0.7709999999999999
36,2020-09-14T23:30:56Z,"CarsPublished on September 14th, 2020 |
 by Zachary Shahan
0
September 14th, 2020 by Zachary Shahan 
I’m changing the format for these weekly updates on the most popular CleanTechnica stories of … [+5210 chars]",0.4754,0.09300000000000001,0.0,0.907
37,2020-09-14T22:22:42Z,"After Netgear's (NTGR) 19% return beat the S&amp;P 500 (SPY), which rose 13% since this post, its prospects only improved. The reemergence of the Covid-19 pandemic worldwide suggests the stay-at-home… [+5086 chars]",0.6486,0.15,0.0,0.85
38,2020-09-14T22:02:00Z,"Dow Jones futures were little changed Monday, along with S&amp;P 500 futures and Nasdaq futures. The stock market rally got a much-needed win, with Apple (AAPL) and Adobe stock rebounding bullishly a… [+8365 chars]",0.5859,0.106,0.0,0.894
39,2020-09-14T21:39:05Z,"While it has been promised for a long time, Tesla Inc's (NASDAQ: TSLA) Full Self Driving software has yet to reach the goal of full autonomy.
The company has quickly been adding features, with the l… [+1422 chars]",0.3818,0.09300000000000001,0.0,0.907
40,2020-09-14T20:35:37Z,"Global stocks rose on Monday, as renewed vaccine hopes and a raft of mergers and acquisitions activity buoyed investors at the start of a big week for central banks. Tech shares rebounded ahead of Ap… [+3584 chars]",0.6124,0.132,0.0,0.868
41,2020-09-14T20:20:36Z,"Authored by Mark Jeftovic via OutOfTheCave.io,
We hear a lot of talk in financial and economic circles about reversion to the mean or some variation: reversion through the mean or that reversion typ… [+8445 chars]",0.0,0.0,0.0,1.0
42,2020-09-14T19:38:42Z,"Last week's shortened Holiday Week, the song we chose to embody Stock Market sentiment is Barry Whites, Never Gonna Give you Up.
With the Nasdaq falling almost 11% in a few short trading days, AAPL … [+5468 chars]",0.2732,0.07,0.042,0.888
43,2020-09-14T18:23:41Z,"Tesla Inc (NASDAQ: TSLA) has been installing the company's solar roof product for over a year now, and ramping up installation speed and production during that time.
Now it looks like Tesla will be … [+654 chars]",0.3612,0.068,0.0,0.932
44,2020-09-14T16:43:15Z,"Commodities are the essential products that we all use in our day-to-day lives. While production is a local affair, consumption is ubiquitous. Commodities come from parts of the world where the earth… [+8315 chars]",0.0,0.0,0.0,1.0
45,2020-09-14T16:29:38Z,"Navistar's (NAV) story over the last two decades has been a difficult one, with the company losing significant share in its core medium-duty and heavy-duty truck markets and suffering repeated hits t… [+10470 chars]",-0.6369,0.1,0.204,0.6970000000000001
46,2020-09-14T16:26:32Z,"This morning Nikola (NKLA) released a rebuttal addressing some the most damning allegations of a short-seller report which had sent the companys stock spiraling on Thursday and Friday of last week.
… [+3780 chars]",-0.4005,0.0,0.08199999999999999,0.9179999999999999
47,2020-09-14T16:10:36Z,Shares of electric and hydrogen-electric semi maker Nikola Corp. (NASDAQ: NKLA) dropped by 24% last week following a scathing report from short seller Hindenburg Research. The company put out a brief… [+3127 chars],0.29600000000000004,0.068,0.0,0.932
48,2020-09-14T15:58:51Z,"Winds of change are sweeping through the global automotive industry, forcing General Motors Co. (GM) and others to find partners with whom to share technology and capital costs in order to sustain pr… [+6013 chars]",0.29600000000000004,0.061,0.0,0.9390000000000001
49,2020-09-14T15:56:45Z,"With the S&amp;P 500 recently hitting all-time highs, many investors are looking to lower risk in their portfolios. They should start by eliminating extremely risky holdings. As we covered recently, … [+21994 chars]",-0.659,0.0,0.18100000000000002,0.8190000000000001
50,2020-09-14T15:00:00Z,We first warned investors about Ubers unrealistic valuation before its IPO in April 2019: Ubers IPO Valuation Makes No Sense. After an underwhelming IPO and its firsts earnings report as a public com… [+23013 chars],-0.5106,0.0,0.11800000000000001,0.882
51,2020-09-14T14:34:06Z,"When Tesla Inc (NASDAQ: TSLA) introduced the mass market Model Y, a vehicle with 70% similarity to the already popular Model 3, several design improvements and changes came with the new model.
Two o… [+987 chars]",0.6249,0.134,0.0,0.866
52,2020-09-14T13:31:00Z,"NEW YORK, Sept. 14, 2020 /PRNewswire/ -- InvestorsObserver issues critical PriceWatch Alerts for IMMU, ORCL, VIR, UAL, and TSLA.
Click a link below then choose between in-depth options trade idea re… [+562 chars]",-0.3182,0.0,0.069,0.9309999999999999
53,2020-09-14T13:22:02Z,"Getty Images
Getty Images
Key Takeaways:
<ul><li>M&amp;A news appears to be giving market a positive tone early on</li><li>Oracle 
 ORCL
 shares blast higher on news reports of TikTok partnershi… [+11031 chars]",0.802,0.24,0.0,0.76
54,2020-09-14T12:53:04Z,"Companies that start raising money because they can on a repetitive basis tend to lose the loyalty of investors involved, said Irwin. I think theyre savvy enough to know that and I just dont expect a… [+1139 chars]",-0.0516,0.087,0.11699999999999999,0.7959999999999999
55,2020-09-14T12:40:04Z,"U.S. equity markets rallied Monday amid optimism a COVID-19 vaccine will be distributed by yearend and amid a flurry of deals.
The Nasdaq Composite traded up 2% as tech stocks continued to dictate t… [+4343 chars]",0.5423,0.096,0.0,0.904
56,2020-09-14T12:30:16Z,"2020's summer rally for the S&amp;P 500 (Index: SPX) came to a crashing end on September 3, 2020. It turns out a good portion of the rally that preceded its sudden was juiced by an unusual investment… [+3163 chars]",0.4404,0.075,0.0,0.925
58,2020-09-14T11:28:47Z,Last week I posted a video highlighting 6 attractively valued tech stocks in the dividend growth space that I think income-oriented investors should consider amidst the tech wreck. This is the writte… [+28325 chars],0.7003,0.231,0.077,0.691
59,2020-09-14T11:17:43Z,"Elon Musk has been speeding up to perfect Tesla technologies while giving its clients great driving experience, but he also keeps his promises to his fans and clients.
According to a Tesmanian repor… [+3525 chars]",0.8402,0.25,0.0,0.75
60,2020-09-14T10:52:52Z,Being in tune with current technological developments means being aware of the potential transformational consequences of disruptive technologies in our society. One of the most disruptive technologi… [+9352 chars],-0.5574,0.0,0.146,0.8540000000000001
61,2020-09-14T10:30:00Z,"For my regular readers, today's piece is very different than anything that I have written both in terms of approach and thought process. Generally speaking, I am a value investor that spends most of … [+10467 chars]",0.34,0.07,0.0,0.93
62,2020-09-14T09:33:31Z,"Tesla Inc (NASDAQ: TSLA) CEO Elon Musk said over the weekend that Microsoft Inc (NASDAQ: MSFT) co-founder Bill Gates is clueless about electric trucks.
What Happened: Musk was responding to a Twitte… [+1036 chars]",-0.3612,0.0,0.07200000000000001,0.9279999999999999
63,2020-09-14T09:00:09Z,"Selling returned to the market in a big way recently, with the Nasdaq down 10% off its September 2 highs. Tech stocks and coronavirus standouts such as Tesla TSLA and Apple AAPL have been sold as Wal… [+4845 chars]",0.0,0.0,0.0,1.0
64,2020-09-14T02:21:00Z,"Dow Jones futures rose solidly Sunday night, along with S&amp;P 500 futures and Nasdaq futures, amid several big merger deals and coronavirus vaccine news. The stock market rally is still in force, b… [+9615 chars]",0.0,0.0,0.0,1.0
65,2020-09-14T01:39:10Z,"Source
Great investing is not simply about selecting the right investment ideas. The main factor in the success of your investing journey is about avoiding common behavioral mistakes that we all mak… [+21395 chars]",0.5994,0.183,0.115,0.703
67,2020-09-14T00:28:14Z,"Nikola (NKLA) is establishing itself as one of the most volatile stocks in the market. After surging nearly 40% on news of the Nikola-General Motors (GM) deal, Nikola's stock quickly plunged as a res… [+5625 chars]",0.0,0.0,0.0,1.0
68,2020-09-13T22:24:09Z,"The S&amp;P/ASX 200 Index (ASX: XJO) has just notched up its fourth week in a row in the red, giving investors another hefty 1.1% loss for the week. It caps off a wild and furious month, which has se… [+6360 chars]",-0.5574,0.054000000000000006,0.135,0.8109999999999999
69,2020-09-13T18:12:39Z,"Management at Tesla (NASDAQ:TSLA) has constantly reiterated that energy storage is targeted to be 50% of company revenue. As my recent article detailed, this was most recently restated at the Q2 earn… [+20858 chars]",0.2732,0.06,0.0,0.94
70,2020-09-13T18:07:22Z,"Every week theres usually at least one article in CoinDesk, a blurb in a newsletter and several charts in the Twittersphere about bitcoins correlation with something or other.
This week, we were tol… [+13403 chars]",0.0,0.0,0.0,1.0
71,2020-09-13T18:07:22Z,"Every week theres usually at least one article in CoinDesk, a blurb in a newsletter and several charts in the Twittersphere about bitcoins correlation with something or other.
This week, we were tol… [+13602 chars]",0.0,0.0,0.0,1.0
72,2020-09-13T15:56:27Z,"Note: I have written about Scottish Mortgage previously, investors should see this as an update to my earlier article on the company.
The meteoric rise in the Tesla (TSLA) share price over the last … [+9923 chars]",0.29600000000000004,0.061,0.0,0.9390000000000001
73,2020-09-13T15:20:19Z,"Shareholders of Tesla Inc. (NASDAQ: TSLA) approved a compensation plan for CEO Elon Musk back in 2018 that may complicate future inclusion in the S&amp;P 500.
What Happened: The Wall Street Journal … [+2116 chars]",0.4215,0.08,0.0,0.92
74,2020-09-13T14:44:07Z,NextEra Energy (NEE) continues to be one of the most forward-looking power companies in the world. The company is highly diversified across traditional and emerging energy industries. NextEra Energy'… [+4055 chars],0.4939,0.127,0.0,0.873
76,2020-09-13T14:40:46Z,"Introduction - following a tried and true playbook
Not following its usual practice, UPS (UPS) appointed a board member as CEO as of June 1: Carol Tome, the long-serving CFO of Home Depot (HD). This… [+12199 chars]",0.4215,0.078,0.0,0.922
78,2020-09-13T11:11:00Z,"Last month, Tesla (NASDAQ:TSLA) and Apple (NASDAQ:AAPL) carried out 5-for-1 and 4-for-1 splits respectively. Leading into the splits, both stocks furiously rallied to new highs on the news.
With inv… [+4449 chars]",-0.128,0.068,0.08199999999999999,0.85
79,2020-09-13T08:43:54Z,"Tesla (TSLA) is in talks with Canadian miner Giga Metals about helping to develop a large mine that would provide it with low carbon nickel access for its batteries, Reuters reports, citing three sou… [+2478 chars]",0.0258,0.059000000000000004,0.055999999999999994,0.885
80,2020-09-13T01:40:12Z,"The roller coaster ride on equity markets is enough to send your head spinning with many investors questioning if this is the end of the bull market.
The sharp fall in the share prices of tech darli… [+3927 chars]",0.2023,0.054000000000000006,0.034,0.9109999999999999
81,2020-09-12T19:16:42Z,"Andrew Bary and Avi Salzman's ""Retail Investors Are Fueling the Nasdaq's Wild Ride"" points out how heavy buying of call options on stocks like Apple Inc (NASDAQ: AAPL) and Tesla Inc (NASDAQ: TSLA) ar… [+2102 chars]",0.3612,0.067,0.0,0.9329999999999999
82,2020-09-12T18:11:36Z,"The big U.S. indexes ended another volatile week in the red, led by a 4% retreat in the Nasdaq. Investors have their eyes on moves by the Oracle of Omaha and the upcoming iPhone launch. The week also… [+2621 chars]",0.2023,0.045,0.0,0.955
83,2020-09-12T16:02:53Z,"One thing that has been driving Tesla Inc (NASDAQ:TSLA) stock recently is the expectation that it would be added to the S&amp;P 500. However, that didnt happen, and investors started unloading the sh… [+2587 chars]",0.0,0.0,0.0,1.0
84,2020-09-12T14:51:31Z,"At EarningsBeats.com, we provide market guidance and analysis of the major indices, sectors, industry groups, and individual stocks. Our research provides our members with various ChartLists to organ… [+5785 chars]",0.0,0.0,0.0,1.0
85,2020-09-12T14:48:00Z,"Getty
Is this a quick (buyable) blip? Or the next bear market?
While the Wall Street suits guess away, we can do better than the buy and hope crowd. After all, why hope when we can secure our retir… [+6002 chars]",0.8875,0.24100000000000002,0.0,0.759
86,2020-09-12T13:00:00Z,"Most investors invest the majority of their capital into regular stocks and bonds.
I prefer to invest most of my capital into real assets investments, which include REITs, MLPs, YieldCos, and other … [+11960 chars]",0.1779,0.05,0.0,0.95
87,2020-09-12T12:40:00Z,"As Tesla was busy becoming the most valuable automaker in the world, minting a market capitalization well over $350 billion, a bunch of new names were entering the electric-vehicle race.
Lucid, Niko… [+9126 chars]",0.6697,0.155,0.0,0.845
88,2020-09-12T12:12:00Z,"Some Tesla Model Y owners have made an interesting discovery when exploring the inner bowels of their vehicles.
""Someone made a run to Home Depot to make Q2 numbers,"" someone said on the Tesla Motor… [+1143 chars]",0.4019,0.07400000000000001,0.0,0.9259999999999999
89,2020-09-12T11:31:33Z,"A new wave of investors suffered big losses in recent days, getting a harsh lesson on how the stock market works.
Technology stocks plunged over a three-day trading span that ended Tuesday by their … [+8524 chars]",-0.8316,0.0,0.22699999999999998,0.773
90,2020-09-12T09:30:00Z,"Tesla 
 TSLA
 has been the main stock market headline in the electric vehicle business, becoming the most valuable car company in the world, and passing Visa to become the seventh largest US compan… [+5147 chars]",0.5256,0.091,0.0,0.909
91,2020-09-12T08:55:00Z,"Traders in the S&amp;P 500 pit at the Chicago Mercantile Exchange Group (Photo by John Gress/Corbis via ... [+] Getty Images)
Corbis via Getty Images
Volume has played an important role in my analy… [+6730 chars]",0.4939,0.11,0.0,0.89
92,2020-09-12T04:59:00Z,"An old allegation on Tesla cars is back to haunt the company yet again with a recent incident involving two fatalities and several injured. The accident that took place last week in Nanchong, China, … [+2546 chars]",-0.9081,0.0,0.28600000000000003,0.7140000000000001
93,2020-09-12T03:27:36Z,"Clean PowerPublished on September 11th, 2020 |
 by Frugal Moogal
0
September 11th, 2020 by Frugal Moogal 
Note: Nothing below is investment advice.
I appreciate how many comments my articles ten… [+9709 chars]",0.6597,0.162,0.0,0.838
94,2020-09-18T22:21:21Z,"FAANGs? No thangsI dont care for the acronym. Too menacing, plus the G should really be an A for 
 Alphabet.
 My colleague Al Root argues that 
 Microsoft 
 and 
 Tesla 
 deserve to be counted … [+5792 chars]",-0.7527,0.0,0.198,0.802
95,2020-09-18T21:26:16Z,"Next week will be a big one for Tesla (TSLA). Alongside its annual shareholder meeting, on Tuesday (September 22) the EV maker will host its highly anticipated Battery Day. The event has been the sou… [+2765 chars]",0.0,0.0,0.0,1.0
96,2020-09-18T21:15:38Z,"Incogmeato by MorningStar Farms aims to win over kids with plant-based chicken nuggets shaped like ... [+] Mickey Mouse. 
Incogmeato by MorningStar Farms
Innovation has fueled the rise in plant-bas… [+5943 chars]",0.836,0.235,0.0,0.765
97,2020-09-18T18:03:21Z,"U.S. stocks on Friday were seeing heavy selling pressure, led by declines in large-capitalization technology-related companies. The selling action managed to erase weekly gains for the Dow Jones Indu… [+937 chars]",0.0516,0.071,0.065,0.863
